{
  "$schema": "./schema/rule-pack.schema.json",
  "schema_version": "3.0.0",
  "id": "fhag",
  "name": "Fair Housing Act Design Manual",
  "version": "1998 (rev.)",
  "category": "fair-housing",
  "tags": ["fair-housing", "residential", "accessibility", "public-domain"],
  "jurisdiction": { "country": "US", "adopting_body": "U.S. Department of Housing and Urban Development (HUD)" },
  "applies_to": ["Residential"],
  "source_authority": "U.S. Department of Housing and Urban Development (HUD)",
  "source_url": "https://www.huduser.gov/portal/publications/PDF/fairhousing/fairfull.pdf",
  "license": "public-domain",
  "placeholders": {
    "covered_multifamily": {
      "type": "boolean",
      "default": true,
      "label": "Covered Multifamily Dwelling (FHA-applicable)",
      "description": "FHA design requirements apply to covered multifamily dwellings (4+ unit buildings) designed/constructed for first occupancy after March 13, 1991.",
      "group": "Fair Housing"
    }
  },
  "rules": [
    {
      "id": "FHA-1",
      "code_section": "FHA Design Requirement 1",
      "category": "fair-housing",
      "severity": "high",
      "label": "Accessible Building Entrance on an Accessible Route",
      "applies_to": ["Residential"],
      "applies_when": "placeholders.covered_multifamily == true",
      "check_fn": "manual",
      "tags": ["fair-housing"],
      "notes_template": "Verify at least one accessible building entrance on an accessible route from a site arrival point (parking, public transit, public sidewalk).",
      "citation": "FHA Design Manual / 24 CFR 100.205(a) – Public/common-use areas must be accessible; an accessible building entrance on an accessible route is required.",
      "remediation": "Provide accessible route from site arrival points to a building entrance with ≤ 1:20 running slope, ≤ 1:48 cross slope, ≥ 36 in. clear width."
    },
    {
      "id": "FHA-2",
      "code_section": "FHA Design Requirement 2",
      "category": "fair-housing",
      "severity": "high",
      "label": "Accessible & Usable Public/Common-Use Areas",
      "applies_to": ["Residential"],
      "applies_when": "placeholders.covered_multifamily == true",
      "check_fn": "manual",
      "tags": ["fair-housing"],
      "notes_template": "Verify public and common-use areas (lobbies, mailrooms, laundry, recreation, parking) are accessible and usable.",
      "citation": "FHA Design Manual / 24 CFR 100.205(c)(1) – Public and common-use portions of covered multifamily dwellings must be readily accessible to and usable by persons with disabilities.",
      "remediation": "Apply ANSI A117.1 / ADA technical to common areas: routes, doors, restrooms, controls."
    },
    {
      "id": "FHA-3",
      "code_section": "FHA Design Requirement 3",
      "category": "fair-housing",
      "severity": "high",
      "label": "Usable Doors",
      "applies_to": ["Residential"],
      "applies_when": "placeholders.covered_multifamily == true",
      "check_fn": "manual",
      "aliases": ["ADA-404.2.3"],
      "tags": ["doors"],
      "notes_template": "Verify all doors designed to allow passage are sufficiently wide (32 in. nominal clear) for passage by a wheelchair user.",
      "citation": "FHA Design Manual / 24 CFR 100.205(c)(2) – All doors designed to allow passage into and within all premises within covered dwellings must be sufficiently wide to allow passage by handicapped persons in wheelchairs.",
      "remediation": "Specify 2'-10\" or wider doors throughout each covered unit."
    },
    {
      "id": "FHA-4",
      "code_section": "FHA Design Requirement 4",
      "category": "fair-housing",
      "severity": "high",
      "label": "Accessible Route Into & Through the Dwelling",
      "applies_to": ["Residential"],
      "applies_when": "placeholders.covered_multifamily == true",
      "check_fn": "manual",
      "tags": ["routes"],
      "notes_template": "Verify accessible route into and through each covered dwelling unit, with no abrupt level changes > 1/4 in. and limited stepped routes only via §100.205(c)(3) exceptions.",
      "citation": "FHA Design Manual / 24 CFR 100.205(c)(3) – Accessible route into and through each covered dwelling unit.",
      "remediation": "Eliminate steps within the unit; provide level entry where required by site conditions or use the limited exception."
    },
    {
      "id": "FHA-5",
      "code_section": "FHA Design Requirement 5",
      "category": "fair-housing",
      "severity": "medium",
      "label": "Light Switches, Outlets, Thermostats, Other Environmental Controls in Accessible Locations",
      "applies_to": ["Residential"],
      "applies_when": "placeholders.covered_multifamily == true",
      "check_fn": "manual",
      "tags": ["controls"],
      "notes_template": "Verify environmental controls within reach ranges: switches and thermostats 48 in. max AFF, outlets 15 in. min AFF.",
      "citation": "FHA Design Manual / 24 CFR 100.205(c)(4) – Light switches, electrical outlets, thermostats, and other environmental controls in accessible locations.",
      "remediation": "Coordinate electrical drawings with FHA reach ranges (48 in. max / 15 in. min)."
    },
    {
      "id": "FHA-6",
      "code_section": "FHA Design Requirement 6",
      "category": "fair-housing",
      "severity": "high",
      "label": "Reinforced Walls for Grab Bars",
      "applies_to": ["Residential"],
      "applies_when": "placeholders.covered_multifamily == true",
      "check_fn": "manual",
      "tags": ["bathrooms"],
      "notes_template": "Verify reinforcement in bathroom walls to allow later installation of grab bars at toilets, tubs, and showers.",
      "citation": "FHA Design Manual / 24 CFR 100.205(c)(5) – Reinforcements in bathroom walls to allow later installation of grab bars.",
      "remediation": "Detail blocking on plans at all toilet, tub, and shower locations within each covered unit."
    },
    {
      "id": "FHA-7",
      "code_section": "FHA Design Requirement 7",
      "category": "fair-housing",
      "severity": "high",
      "label": "Usable Kitchens & Bathrooms",
      "applies_to": ["Residential"],
      "applies_when": "placeholders.covered_multifamily == true",
      "check_fn": "manual",
      "tags": ["kitchens", "bathrooms"],
      "notes_template": "Verify kitchens and bathrooms are usable in that an individual in a wheelchair can maneuver about the space (clear floor space, parallel/perpendicular approaches, U-shaped kitchen 60 in. clearance, etc.).",
      "citation": "FHA Design Manual / 24 CFR 100.205(c)(6) – Usable kitchens and bathrooms such that an individual in a wheelchair can maneuver about the space.",
      "remediation": "Detail kitchen/bathroom clearances per HUD Design Manual; reference ICC A117.1 §1005 (Type B) as a safe harbor."
    }
  ]
}
